{
  "schema_version": "1.0",
  "event_id": "40000000-0000-4000-8000-000000000001",
  "event_type": "radar.grid.requested.v1",
  "occurred_at": "2026-08-24T03:00:30Z",
  "run_id": "10000000-0000-4000-8000-000000000002",
  "job_id": "40000000-0000-4000-8000-000000000002",
  "trace_id": "10000000-0000-4000-8000-000000000003",
  "payload": {
    "scan_id": "10000000-0000-4000-8000-000000000004",
    "radar_id": "synthetic_radar_01",
    "input_uri": "s3://rainpulse/radar/qc/synthetic_radar_01/10000000-0000-4000-8000-000000000004/rp008-basic-1.0.4/volume.zarr",
    "output_prefix": "s3://rainpulse/radar/grid/synthetic_radar_01/2026/08/24/030000/",
    "grid_id": "synthetic-grid-v1",
    "grid_config_version": "synthetic-grid-config-v1",
    "hybrid_scan_version": "hybrid-contract-v1"
  }
}
